{"base_main_sha":"fbfd052e8b76162468f7ee1ff5cd11dad4829497","boundaries":{"autonomous_merge_authorized":false,"codex_start_authorized":false,"external_actions_authorized":false,"founder_accountability_preserved":true,"hermes_activation_authorized":false,"northstar_implementation_authorized":false,"oauth_authorized":false,"paid_services_authorized":false,"phase0_implementation_authorized":false,"phase0_merge_authorized":false,"phase1_authorized":false,"production_deployment_authorized":false,"real_client_data_enabled":false,"runtime_activation_authorized":false},"canonical_branch":"main","canonical_status_phrase":"Chat-first development is complete through CF-P1–7, PCR-01–10, WS-4, WS-5 and WS6.5; final Workstream 6 reconciliation and all manual launch gates remain pending; `codex_start_authorized=false`.","closed_defects":["WS6-CONSIST-002"],"completion":{"all_blocking_defects_closed":false,"all_required_prior_components_pass":true,"compatibility_identifiers_preserved":true,"current_authority_normalized":true,"final_reconciliation_complete":false,"namespace_disjoint":true,"next_permitted_work_package":"WS6.6","ws65_complete":true},"contract_id":"WORKSTREAM6-PHASE-NAMESPACE","forbidden_unqualified_patterns":["\\bCodex Phase 0\\b","\\bPhase 0\\b","\\bPhase 1\\b","\\bPhase 2\\b","\\bPhase 3\\b","\\bPhase 4\\b","\\bPhase 5\\b","\\bPhase 6\\b","\\bPhase 7\\b","\\bPhase 8\\b","\\bPhase 9\\b","\\bPhase 10\\b","\\bPhase 11\\b","\\bPhase 12\\b"],"founder_instruction":{"clean_macos_verified":false,"effective_scope":"WS6.5_chat_first_only","exact_final_main_sha_bound":false,"final_release_bound":false,"founder_approval_intent_received":true,"hosted_controls_verified":false,"imp_p0_start_authorized":false,"instruction":"Proceed with WS6.5 and record Founder approval intent for issue #1.","launch_permit_issued":false,"reason":"The final post-merge SHA, permanent release, hosted controls, clean macOS evidence and local permit do not yet exist.","received_at":"2026-08-06T19:56:00+08:00"},"generated_from":"configs/workstream6-phase-namespace.yaml","legacy_alias_count":14,"legacy_alias_surfaces":["handoff/codex-phase0-issue-final.md"],"legacy_aliases":[{"alias":"Codex Phase 0","allowed_only_when_explicitly_mapped":true,"canonical_id":"IMP-P0","classification":"legacy_display_alias"},{"alias":"Phase 0","allowed_only_when_explicitly_mapped":true,"canonical_id":"IMP-P0","classification":"legacy_display_alias"},{"alias":"Phase 1","allowed_only_when_explicitly_mapped":true,"canonical_id":"IMP-P1","classification":"legacy_display_alias"},{"alias":"Phase 2","allowed_only_when_explicitly_mapped":true,"canonical_id":"IMP-P2","classification":"legacy_display_alias"},{"alias":"Phase 3","allowed_only_when_explicitly_mapped":true,"canonical_id":"IMP-P3","classification":"legacy_display_alias"},{"alias":"Phase 4","allowed_only_when_explicitly_mapped":true,"canonical_id":"IMP-P4","classification":"legacy_display_alias"},{"alias":"Phase 5","allowed_only_when_explicitly_mapped":true,"canonical_id":"IMP-P5","classification":"legacy_display_alias"},{"alias":"Phase 6","allowed_only_when_explicitly_mapped":true,"canonical_id":"IMP-P6","classification":"legacy_display_alias"},{"alias":"Phase 7","allowed_only_when_explicitly_mapped":true,"canonical_id":"IMP-P7","classification":"legacy_display_alias"},{"alias":"Phase 8","allowed_only_when_explicitly_mapped":true,"canonical_id":"IMP-P8","classification":"legacy_display_alias"},{"alias":"Phase 9","allowed_only_when_explicitly_mapped":true,"canonical_id":"IMP-P9","classification":"legacy_display_alias"},{"alias":"Phase 10","allowed_only_when_explicitly_mapped":true,"canonical_id":"IMP-P10","classification":"legacy_display_alias"},{"alias":"Phase 11","allowed_only_when_explicitly_mapped":true,"canonical_id":"IMP-P11","classification":"legacy_display_alias"},{"alias":"Phase 12","allowed_only_when_explicitly_mapped":true,"canonical_id":"IMP-P12","classification":"legacy_display_alias"}],"machine_authority_surfaces":["repository/canonical-authority-registry.json","handoff/codex-phase0-handoff.json","contracts/codex-phase0-launch-control.json","contracts/workstream6-phase-namespace.json"],"namespace_id_count":49,"namespace_order":["CF","PCR","WS","IMP"],"namespaces":[{"canonical_ids":["CF-P1","CF-P2","CF-P3","CF-P4","CF-P5","CF-P6","CF-P7"],"description":"Chat-first design, contracts, fixtures and deterministic logic.","implementation_authority":false,"kind":"chat_first_foundation_package","prefix":"CF-P","state":"complete_integrated"},{"canonical_ids":["PCR-01","PCR-02","PCR-03","PCR-04","PCR-05","PCR-06","PCR-07","PCR-08","PCR-09","PCR-10"],"description":"Pre-Codex reconciliation and repository preparation.","implementation_authority":false,"kind":"pre_codex_reconciliation_package","prefix":"PCR-","state":"complete_integrated"},{"canonical_ids":["WS-4","WS-5","WS6.0","WS6.1","WS6.2","WS6.3","WS6.4","WS6.5","WS6.6","WS6.7","WS6.8","WS6.9","WS6.10","WS6.11","WS6.12","WS6.13","WS6.14","WS6.15","WS6.16"],"description":"Repository readiness, launch control and final reconciliation packages.","implementation_authority":false,"kind":"governance_workstream_package","prefix":"WS","state":"complete_through_WS6.5"},{"canonical_ids":["IMP-P0","IMP-P1","IMP-P2","IMP-P3","IMP-P4","IMP-P5","IMP-P6","IMP-P7","IMP-P8","IMP-P9","IMP-P10","IMP-P11","IMP-P12"],"description":"Future product implementation phases; each requires its own gate.","implementation_authority":false,"kind":"product_implementation_phase","prefix":"IMP-P","state":"not_started"}],"normalization_surfaces":["README.md","docs/00-START-HERE.md","docs/11-BUILD-BACKLOG.md","docs/14-CODEX-KICKOFF.md","docs/19-PHASE-0-VALIDATION-ADDENDUM.md","docs/20-DEVELOPMENT-STATUS.md","handoff/codex-phase0-issue-final.md","handoff/codex-phase0-hosted-controls-issue-final.md","docs/57-WS6-5-PHASE-NAMESPACE-NORMALIZATION.md"],"remaining_blocking_defects":["WS6-BLOCK-006"],"repository":"rayrayxing/offdata-os","required_tokens":{"README.md":["CF-P1–7","PCR-01–10","WS6.5","contracts/workstream6-phase-namespace.json"],"all_surfaces":["IMP-P0"],"docs/00-START-HERE.md":["IMP-P0–12","A completed CF or PCR package is not an implemented product phase"],"docs/11-BUILD-BACKLOG.md":["IMP-P0","IMP-P12","Task identifiers remain `P0.1`"],"docs/14-CODEX-KICKOFF.md":["IMP-P0","IMP-P1"],"docs/19-PHASE-0-VALIDATION-ADDENDUM.md":["IMP-P0","IMP-P1"],"docs/20-DEVELOPMENT-STATUS.md":["WS6.5","WS6-CONSIST-002","WS6.6"],"docs/57-WS6-5-PHASE-NAMESPACE-NORMALIZATION.md":["WS6-CONSIST-002","IMP-P0–12"],"handoff/codex-phase0-hosted-controls-issue-final.md":["IMP-P0","IMP-P1"],"handoff/codex-phase0-issue-final.md":["Codex Phase 0","Phase 1","valid_codex_phase0_launch_permit_issued"]},"rollback":{"after_merge":"Revert WS6.5 as one unit, restore synchronized issue bodies, and keep every implementation and launch boundary false.","before_merge":"Close the WS6.5 pull request and delete only governance/workstream6-phase-namespace-normalization."},"schema_version":"1.0.0","stable_compatibility_identifiers":{"gate_keys":["explicit_founder_phase_0_approval_received","valid_codex_phase0_launch_permit_issued","phase0_implementation_authorized","phase0_merge_authorized","phase1_authorized"],"paths":["handoff/codex-phase0-handoff.json","contracts/codex-phase0-launch-control.json","handoff/codex-phase0-issue-final.md","schemas/codex-phase0-launch-permit.schema.json","scripts/prepare_codex_phase0_launch.py","codex/phase-0-foundation"],"rule":"Compatibility identifiers are stable machine keys or paths. They are not canonical phase labels and confer no authority.","task_ids":["P0.1","P0.2","P0.3","P0.4"]},"status":"phase_namespace_normalized","surface_count":9,"surface_evidence":[{"bytes":5628,"git_blob_sha":"238c36c0c85e2c8ea07926266ae9b0c4890737dd","path":"README.md"},{"bytes":4881,"git_blob_sha":"db1a83ef62c08b533ec6f37a6efe7b07b386189f","path":"docs/00-START-HERE.md"},{"bytes":10360,"git_blob_sha":"4c6005535bf0d4233bea39e36553d49f72d53202","path":"docs/11-BUILD-BACKLOG.md"},{"bytes":6221,"git_blob_sha":"e7dff27a6c18dcbdab094ba4ff2d1191354c263a","path":"docs/14-CODEX-KICKOFF.md"},{"bytes":5867,"git_blob_sha":"f234705e94ad2267ea932efeae14ae4bbb89d496","path":"docs/19-PHASE-0-VALIDATION-ADDENDUM.md"},{"bytes":8129,"git_blob_sha":"fd1a0ccd72423c32ac286bd4a4a07cb332a2ca5c","path":"docs/20-DEVELOPMENT-STATUS.md"},{"bytes":12275,"git_blob_sha":"893079d861cde6d4a771728d27faadd3dfc5850c","path":"handoff/codex-phase0-issue-final.md"},{"bytes":7103,"git_blob_sha":"d572e54bd6519ccd86160d4fb421d12f5c71eb0d","path":"handoff/codex-phase0-hosted-controls-issue-final.md"},{"bytes":3376,"git_blob_sha":"aa0c80e15be1c381b735a9f096c104f1567dd418","path":"docs/57-WS6-5-PHASE-NAMESPACE-NORMALIZATION.md"}],"title":"WS6.5 phase namespace normalization","work_package_id":"WS6.5","workstream_id":"WORKSTREAM-6"}
